{
  "schemaVersion": "1.0.0",
  "viewId": "TRACE-GRAPH-AInvil-Productization-2026-07-06",
  "generatedAt": "2026-07-06T11:28:05.882Z",
  "sourceGraphId": "GRAPH-AInvil-Productization",
  "rows": [
    {
      "rowId": "TRACE-FEAT-E2E-HappyPath-001-REQ-E2E-001-TASK-E2E-001",
      "featureId": "FEAT-E2E-HappyPath-001",
      "requirementId": "REQ-E2E-001",
      "featureSpecId": "FS-E2E-HappyPath",
      "taskId": "TASK-E2E-001",
      "unityTargetId": null,
      "inputSpecId": null,
      "acceptanceId": null,
      "validationEvidenceId": null,
      "validationLevel": "Not Checked",
      "validationEvidenceStatus": "Not Checked",
      "status": "Needs Technical Mapping",
      "missingLinks": [
        "UnityTarget"
      ],
      "nextAction": "Resolve missing UnityTarget."
    },
    {
      "rowId": "TRACE-FEAT-E2E-HappyPath-001-REQ-E2E-002-TASK-E2E-002-AC-E2E-001",
      "featureId": "FEAT-E2E-HappyPath-001",
      "requirementId": "REQ-E2E-002",
      "featureSpecId": "FS-E2E-HappyPath",
      "taskId": "TASK-E2E-002",
      "unityTargetId": null,
      "inputSpecId": null,
      "acceptanceId": "AC-E2E-001",
      "validationEvidenceId": null,
      "validationLevel": "Not Checked",
      "validationEvidenceStatus": "Not Checked",
      "status": "Needs Technical Mapping",
      "missingLinks": [
        "UnityTarget"
      ],
      "nextAction": "Resolve missing UnityTarget."
    },
    {
      "rowId": "TRACE-FEAT-E2E-HappyPath-001-REQ-E2E-002-TASK-E2E-003-AC-E2E-001",
      "featureId": "FEAT-E2E-HappyPath-001",
      "requirementId": "REQ-E2E-002",
      "featureSpecId": "FS-E2E-HappyPath",
      "taskId": "TASK-E2E-003",
      "unityTargetId": null,
      "inputSpecId": null,
      "acceptanceId": "AC-E2E-001",
      "validationEvidenceId": null,
      "validationLevel": "Not Checked",
      "validationEvidenceStatus": "Not Checked",
      "status": "Needs Technical Mapping",
      "missingLinks": [
        "UnityTarget"
      ],
      "nextAction": "Resolve missing UnityTarget."
    },
    {
      "rowId": "TRACE-FEAT-E2E-HappyPath-001-REQ-E2E-003-TASK-E2E-004-UNITY-Bridge-Package-AC-E2E-002",
      "featureId": "FEAT-E2E-HappyPath-001",
      "requirementId": "REQ-E2E-003",
      "featureSpecId": "FS-E2E-HappyPath",
      "taskId": "TASK-E2E-004",
      "unityTargetId": "UNITY-Bridge-Package",
      "inputSpecId": "INPUT-Runtime-Test-Bridge",
      "acceptanceId": "AC-E2E-002",
      "validationEvidenceId": "EVID-ainvil_bridge_smoke_operational-2026-07-06T05-48-18-528Z",
      "validationLevel": "Compile Verified",
      "validationEvidenceStatus": "Passed",
      "status": "Complete",
      "missingLinks": [],
      "nextAction": "Continue validation or milestone review."
    },
    {
      "rowId": "TRACE-FEAT-DRC-MVP-FirstRecoveryJob-REQ-DRC-MVP-001-TASK-DRC-MVP-001-UNITY-DRC-FirstRecoveryJob-Scene-AC-DRC-MVP-001",
      "featureId": "FEAT-DRC-MVP-FirstRecoveryJob",
      "requirementId": "REQ-DRC-MVP-001",
      "featureSpecId": null,
      "taskId": "TASK-DRC-MVP-001",
      "unityTargetId": "UNITY-DRC-FirstRecoveryJob-Scene",
      "inputSpecId": "INPUT-Runtime-Test-Bridge",
      "acceptanceId": "AC-DRC-MVP-001",
      "validationEvidenceId": "EVID-dungeon-recovery-first-playable-build-latest",
      "validationLevel": "Compile Verified",
      "validationEvidenceStatus": "Passed",
      "status": "Needs Feature Spec",
      "missingLinks": [
        "FeatureSpec"
      ],
      "nextAction": "Resolve missing FeatureSpec."
    },
    {
      "rowId": "TRACE-FEAT-DRC-MVP-FirstRecoveryJob-REQ-DRC-MVP-001-TASK-DRC-MVP-001-UNITY-DRC-FirstRecoveryJob-Scene-AC-DRC-MVP-002",
      "featureId": "FEAT-DRC-MVP-FirstRecoveryJob",
      "requirementId": "REQ-DRC-MVP-001",
      "featureSpecId": null,
      "taskId": "TASK-DRC-MVP-001",
      "unityTargetId": "UNITY-DRC-FirstRecoveryJob-Scene",
      "inputSpecId": "INPUT-Runtime-Test-Bridge",
      "acceptanceId": "AC-DRC-MVP-002",
      "validationEvidenceId": "EVID-dungeon-recovery-first-playable-build-latest",
      "validationLevel": "Compile Verified",
      "validationEvidenceStatus": "Passed",
      "status": "Needs Feature Spec",
      "missingLinks": [
        "FeatureSpec"
      ],
      "nextAction": "Resolve missing FeatureSpec."
    },
    {
      "rowId": "TRACE-FEAT-DRC-MVP-FirstRecoveryJob-REQ-DRC-MVP-001-TASK-DRC-MVP-001-UNITY-DRC-FirstRecoveryJob-Scene-AC-DRC-MVP-003",
      "featureId": "FEAT-DRC-MVP-FirstRecoveryJob",
      "requirementId": "REQ-DRC-MVP-001",
      "featureSpecId": null,
      "taskId": "TASK-DRC-MVP-001",
      "unityTargetId": "UNITY-DRC-FirstRecoveryJob-Scene",
      "inputSpecId": "INPUT-Runtime-Test-Bridge",
      "acceptanceId": "AC-DRC-MVP-003",
      "validationEvidenceId": "EVID-dungeon-recovery-first-playable-build-latest",
      "validationLevel": "Compile Verified",
      "validationEvidenceStatus": "Passed",
      "status": "Needs Feature Spec",
      "missingLinks": [
        "FeatureSpec"
      ],
      "nextAction": "Resolve missing FeatureSpec."
    },
    {
      "rowId": "TRACE-FEAT-DRC-MVP-FirstRecoveryJob-REQ-DRC-MVP-001-TASK-DRC-MVP-001-UNITY-DRC-FirstPlayable-Scripts-AC-DRC-MVP-001",
      "featureId": "FEAT-DRC-MVP-FirstRecoveryJob",
      "requirementId": "REQ-DRC-MVP-001",
      "featureSpecId": null,
      "taskId": "TASK-DRC-MVP-001",
      "unityTargetId": "UNITY-DRC-FirstPlayable-Scripts",
      "inputSpecId": "INPUT-Runtime-Test-Bridge",
      "acceptanceId": "AC-DRC-MVP-001",
      "validationEvidenceId": "EVID-dungeon-recovery-first-playable-build-latest",
      "validationLevel": "Compile Verified",
      "validationEvidenceStatus": "Passed",
      "status": "Needs Feature Spec",
      "missingLinks": [
        "FeatureSpec"
      ],
      "nextAction": "Resolve missing FeatureSpec."
    },
    {
      "rowId": "TRACE-FEAT-DRC-MVP-FirstRecoveryJob-REQ-DRC-MVP-001-TASK-DRC-MVP-001-UNITY-DRC-FirstPlayable-Scripts-AC-DRC-MVP-002",
      "featureId": "FEAT-DRC-MVP-FirstRecoveryJob",
      "requirementId": "REQ-DRC-MVP-001",
      "featureSpecId": null,
      "taskId": "TASK-DRC-MVP-001",
      "unityTargetId": "UNITY-DRC-FirstPlayable-Scripts",
      "inputSpecId": "INPUT-Runtime-Test-Bridge",
      "acceptanceId": "AC-DRC-MVP-002",
      "validationEvidenceId": "EVID-dungeon-recovery-first-playable-build-latest",
      "validationLevel": "Compile Verified",
      "validationEvidenceStatus": "Passed",
      "status": "Needs Feature Spec",
      "missingLinks": [
        "FeatureSpec"
      ],
      "nextAction": "Resolve missing FeatureSpec."
    },
    {
      "rowId": "TRACE-FEAT-DRC-MVP-FirstRecoveryJob-REQ-DRC-MVP-001-TASK-DRC-MVP-001-UNITY-DRC-FirstPlayable-Scripts-AC-DRC-MVP-003",
      "featureId": "FEAT-DRC-MVP-FirstRecoveryJob",
      "requirementId": "REQ-DRC-MVP-001",
      "featureSpecId": null,
      "taskId": "TASK-DRC-MVP-001",
      "unityTargetId": "UNITY-DRC-FirstPlayable-Scripts",
      "inputSpecId": "INPUT-Runtime-Test-Bridge",
      "acceptanceId": "AC-DRC-MVP-003",
      "validationEvidenceId": "EVID-dungeon-recovery-first-playable-build-latest",
      "validationLevel": "Compile Verified",
      "validationEvidenceStatus": "Passed",
      "status": "Needs Feature Spec",
      "missingLinks": [
        "FeatureSpec"
      ],
      "nextAction": "Resolve missing FeatureSpec."
    },
    {
      "rowId": "TRACE-FEAT-DRC-MVP-FirstRecoveryJob-REQ-DRC-MVP-001-TASK-DRC-MVP-002-AC-DRC-MVP-001",
      "featureId": "FEAT-DRC-MVP-FirstRecoveryJob",
      "requirementId": "REQ-DRC-MVP-001",
      "featureSpecId": null,
      "taskId": "TASK-DRC-MVP-002",
      "unityTargetId": null,
      "inputSpecId": null,
      "acceptanceId": "AC-DRC-MVP-001",
      "validationEvidenceId": null,
      "validationLevel": "Not Checked",
      "validationEvidenceStatus": "Not Checked",
      "status": "Needs Technical Mapping",
      "missingLinks": [
        "UnityTarget"
      ],
      "nextAction": "Resolve missing UnityTarget."
    },
    {
      "rowId": "TRACE-FEAT-DRC-MVP-FirstRecoveryJob-REQ-DRC-MVP-001-TASK-DRC-MVP-003-AC-DRC-MVP-001",
      "featureId": "FEAT-DRC-MVP-FirstRecoveryJob",
      "requirementId": "REQ-DRC-MVP-001",
      "featureSpecId": null,
      "taskId": "TASK-DRC-MVP-003",
      "unityTargetId": null,
      "inputSpecId": null,
      "acceptanceId": "AC-DRC-MVP-001",
      "validationEvidenceId": null,
      "validationLevel": "Not Checked",
      "validationEvidenceStatus": "Not Checked",
      "status": "Needs Technical Mapping",
      "missingLinks": [
        "UnityTarget"
      ],
      "nextAction": "Resolve missing UnityTarget."
    },
    {
      "rowId": "TRACE-FEAT-DRC-PROC-RecoveryJob-REQ-DRC-PROC-001-TASK-DRC-PROC-001-UNITY-DRC-ProceduralRecoveryJob-Scene-AC-DRC-PROC-001",
      "featureId": "FEAT-DRC-PROC-RecoveryJob",
      "requirementId": "REQ-DRC-PROC-001",
      "featureSpecId": null,
      "taskId": "TASK-DRC-PROC-001",
      "unityTargetId": "UNITY-DRC-ProceduralRecoveryJob-Scene",
      "inputSpecId": "INPUT-Runtime-Test-Bridge",
      "acceptanceId": "AC-DRC-PROC-001",
      "validationEvidenceId": "EVID-dungeon_recovery_procedural_recovery_job_e2e-2026-07-06T06-14-54-243Z",
      "validationLevel": "Play Mode Verified",
      "validationEvidenceStatus": "Passed",
      "status": "Needs Feature Spec",
      "missingLinks": [
        "FeatureSpec"
      ],
      "nextAction": "Resolve missing FeatureSpec."
    },
    {
      "rowId": "TRACE-FEAT-DRC-PROC-RecoveryJob-REQ-DRC-PROC-001-TASK-DRC-PROC-001-UNITY-DRC-ProceduralRecoveryJob-Scene-AC-DRC-PROC-002",
      "featureId": "FEAT-DRC-PROC-RecoveryJob",
      "requirementId": "REQ-DRC-PROC-001",
      "featureSpecId": null,
      "taskId": "TASK-DRC-PROC-001",
      "unityTargetId": "UNITY-DRC-ProceduralRecoveryJob-Scene",
      "inputSpecId": "INPUT-Runtime-Test-Bridge",
      "acceptanceId": "AC-DRC-PROC-002",